{
  "$schema": "https://json-schema.org/draft/2020-12/schema",
  "$id": "https://github.com/scriptorium-suite/scriptorium-spec/blob/main/schemas/review/v1.json",
  "title": "Scriptorium Review v1",
  "description": "A research-direction synthesis (narrative + comparison table) produced by the synthesize-direction agent task in answer to a question/topic. Outline -> draft -> critique narrative across `sections`, an optional paper-by-paper `comparison_table`, identified `gaps`, and `priority_reads`. Anti-fabrication: the comparison table and citations MUST be grounded in parsed-paper / library-kb, never invented by the model. It may reference a lineage-graph via `lineage_ref` and be materialized as Markdown. Provenance locally ingests validated files as reference-only research artifacts, not approved claims. Additive contract — supersedes nothing. See specs/literature-reading.md §3.",
  "type": "object",
  "required": ["schema_version", "direction", "sections"],
  "properties": {
    "schema_version": { "const": "review/1.0" },
    "direction": {
      "type": "object",
      "description": "The research direction this review synthesizes.",
      "required": ["query", "created"],
      "properties": {
        "query": { "type": "string", "description": "The question / topic that scoped the synthesis." },
        "created": { "type": "string", "description": "ISO 8601 date or date-time when the review was produced." }
      }
    },
    "sections": {
      "type": "array",
      "description": "The narrative body in reading order (outline -> draft -> critique shape).",
      "items": {
        "type": "object",
        "required": ["heading", "prose"],
        "properties": {
          "heading": { "type": "string" },
          "prose": { "type": "string", "description": "Section prose. Any citation must reference parsed-paper / library-kb, never invented." }
        }
      }
    },
    "comparison_table": {
      "type": "object",
      "description": "A paper-by-paper comparison. Rows are papers by citekey; columns are dimensions (method / data / result / ...). Built FROM the parsed files + library-kb, never invented (anti-fabrication).",
      "properties": {
        "columns": {
          "type": "array",
          "description": "Column headers, e.g. [\"Method\", \"Calibration data\", \"Reported error\"].",
          "items": { "type": "string" }
        },
        "rows": {
          "type": "array",
          "items": {
            "type": "object",
            "required": ["citekey", "cells"],
            "properties": {
              "citekey": { "type": "string", "description": "The paper this row describes (Better BibTeX citekey)." },
              "cells": {
                "type": "array",
                "description": "Cell values aligned to `columns`.",
                "items": { "type": "string" }
              }
            }
          }
        }
      }
    },
    "gaps": {
      "type": "array",
      "description": "Open questions / gaps the synthesis surfaced in the direction.",
      "items": { "type": "string" }
    },
    "priority_reads": {
      "type": "array",
      "description": "Citekeys the synthesis recommends reading next.",
      "items": { "type": "string" }
    },
    "lineage_ref": {
      "type": "string",
      "description": "Path to the lineage-graph file this review's direction maps to (optional cross-link)."
    }
  }
}
